{
  "version": "1.0.0",
  "name": "example-agent",
  "description": "Example agent demonstrating BAML + TypeScript packaging",
  "entry_point": "dist/index.js",
  "baml_schema_version": "1.0",
  "runtime_version": "0.1.0",
  "dependencies": {
    "node": ">=20.0.0"
  },
  "metadata": {
    "author": "Agent Developer",
    "created_at": "2024-12-14T00:00:00Z",
    "tags": ["agent", "baml", "example"]
  }
}

